{"aggregation_audit":{"checked":8,"evidence":["audit/aggregation_mismatches.json"],"matched":8,"passed":true},"artifact_graph_audit":{"checked":215,"evidence":["audit/artifact_graph.json"],"matched":215,"passed":true},"audit_hash":"e8ec0f36d12ecd9cb67321dcb5fbfc632def18d51bb5952905dc1d40ddc70210","claims_audit":{"checked":6,"evidence":["reports/claim_ledger.json","reports/CLAIMS.md"],"matched":6,"passed":true},"contract_audit":{"checked":12,"evidence":["audit/contract_mismatches.json"],"matched":12,"passed":true},"controls_audit":{"checked":10,"evidence":["controls/control_results.jsonl"],"matched":10,"passed":true},"corruption_audit":{"checked":12,"evidence":["audit/corruption_report.json"],"matched":12,"passed":true},"final_verdict":"PASS — POSITIVE EXTERNAL","findings":[],"overall_pass":true,"phase":4,"planner_audit":{"checked":64,"evidence":["audit/independent_results.parquet","audit/planner_mismatches.json"],"matched":64,"passed":true},"run_id":"external_v01_polaris_pr4992","source_audit":{"checked":26,"evidence":["audit/source_mismatches.json"],"matched":26,"passed":true},"supported_claim_findings":0,"touch_audit":{"checked":1,"evidence":["audit/independent_touch.parquet","audit/touch_mismatches.json"],"matched":1,"passed":true}}
